{
  "protocol": 2, "request_id": "synthetic-prepare", "type": "control", "action": "prepare",
  "operation": "synthetic-mask", "operation_version": "0.0.0-example",
  "resource": {"id": "example.synthetic.unavailable-model", "version": "0.0.0-example", "manifest_digest": "0000000000000000000000000000000000000000000000000000000000000000"},
  "device_policy": {"mode": "exact", "target_device": "example.synthetic.cpu", "allowed_backends": ["example.synthetic"], "allow_graph_fallback": false},
  "sections": []
}
